{
  "schema_version": 1,
  "asset_type": "animation",
  "id": "chef_idle",
  "display_name": "Chef Idle",
  "description": "Looping idle: breathing, a slight head tilt, arm sway and a blink.",
  "tags": ["chef", "idle", "loop"],
  "author": "OasisFx examples",
  "target_scene": "res://addons/oasis_fx/presets/examples/rigs/chef_rig.tscn",
  "duration_seconds": 1.6,
  "loop": true,
  "tracks": [
    {
      "node": "Body/Skeleton/Hips/Chest",
      "property": "position",
      "interpolation": "cubic",
      "keys": [
        {"time": 0, "value": [0, -2]},
        {"time": 0.8, "value": [0, -3.5]},
        {"time": 1.6, "value": [0, -2]}
      ]
    },
    {
      "node": "Body/Skeleton/Hips/Chest/Head",
      "property": "rotation_degrees",
      "interpolation": "cubic",
      "keys": [
        {"time": 0, "value": 0},
        {"time": 0.5, "value": 3},
        {"time": 1.2, "value": -2},
        {"time": 1.6, "value": 0}
      ]
    },
    {
      "node": "Body/Skeleton/Hips/Chest/ArmL",
      "property": "rotation_degrees",
      "interpolation": "cubic",
      "keys": [
        {"time": 0, "value": 4},
        {"time": 0.8, "value": -4},
        {"time": 1.6, "value": 4}
      ]
    },
    {
      "node": "Body/Skeleton/Hips/Chest/ArmR",
      "property": "rotation_degrees",
      "interpolation": "cubic",
      "keys": [
        {"time": 0, "value": -4},
        {"time": 0.8, "value": 4},
        {"time": 1.6, "value": -4}
      ]
    },
    {
      "node": "Body/Skeleton/Hips/Chest/Head/Eyes",
      "property": "scale",
      "keys": [
        {"time": 0, "value": [1, 1]},
        {"time": 1, "value": [1, 1]},
        {"time": 1.06, "value": [1, 0.15]},
        {"time": 1.12, "value": [1, 1]}
      ]
    }
  ]
}
