{
  "schema_version": 1,
  "asset_type": "animation",
  "id": "sand_serpent_slither",
  "display_name": "Sand Serpent Slither",
  "description": "Looping slither of the generated Sand Serpent rig: a wave runs along the spine bones (the body polygon bends with them) while IK keeps the head steady; a hiss event at the fang.",
  "tags": ["serpent", "creature", "loop", "deform"],
  "author": "OasisFx examples",
  "target_scene": "res://examples/runtime_demo/fx/sand_serpent.tscn",
  "duration_seconds": 1.6,
  "loop": true,
  "tracks": [
    {
      "node": "Skeleton/spine_1/spine_2",
      "property": "rotation_degrees",
      "interpolation": "cubic",
      "keys": [
        {"time": 0, "value": 0},
        {"time": 0.4, "value": 14},
        {"time": 0.8, "value": 0},
        {"time": 1.2, "value": -14},
        {"time": 1.6, "value": 0}
      ]
    },
    {
      "node": "Skeleton/spine_1/spine_2/spine_3",
      "property": "rotation_degrees",
      "interpolation": "cubic",
      "keys": [
        {"time": 0, "value": -14},
        {"time": 0.4, "value": 0},
        {"time": 0.8, "value": 14},
        {"time": 1.2, "value": 0},
        {"time": 1.6, "value": -14}
      ]
    },
    {
      "node": "Skeleton/spine_1/spine_2/spine_3/spine_4",
      "property": "rotation_degrees",
      "interpolation": "cubic",
      "keys": [
        {"time": 0, "value": 0},
        {"time": 0.4, "value": -14},
        {"time": 0.8, "value": 0},
        {"time": 1.2, "value": 14},
        {"time": 1.6, "value": 0}
      ]
    },
    {
      "node": "IKTargets/head",
      "property": "position",
      "interpolation": "cubic",
      "keys": [
        {"time": 0, "value": [120, -14]},
        {"time": 0.4, "value": [118, -22]},
        {"time": 0.8, "value": [120, -14]},
        {"time": 1.2, "value": [122, -20]},
        {"time": 1.6, "value": [120, -14]}
      ]
    }
  ],
  "events": [
    {
      "time": 0.8,
      "name": "hiss",
      "at": "Skeleton/spine_1/spine_2/spine_3/spine_4/spine_5/spine_6/fang"
    }
  ]
}
